,author,body,score,created_utc,subreddit
72,arcturnus,"&gt;I have a follow up question on funding. How dire do you think the funding situation is for aging research? Put another way, is the field currently more starved for talent and interest, or for funding?

That's a really good question, and one where I'm not in a position to best answer, but I'll share my thoughts. If we ignore the private sector for a moment and just focus on basic research in academia, then despite wanting us to spend far more money on research than we do, I'd say we are more in need of passionate researchers than funds, simply because if you were to pursue a degree in aging biology you would have no problem getting into a lab. There aren't many biologists sitting on the sidelines waiting for funding. (That being said, there is a difference between working in an academic lab while you are doing grad work and getting a degree to go work in a lab. If you look at the openings at Calico for example, they aren't looking for people who just graduated with a B.S. in biology. Some of their openings say BS/MS or PhD, but you don't hire someone with just a BS for a Senior Research position unless they are an anomaly, and most require a PhD plus experience. To get one of these jobs you could expect to have a PhD and have already done some postdoc work, so you're looking at 8 - 12 years of your life just to qualify for a position. Since you are already working as a data scientist you might actually qualify for one of the data positions now, so keep that in mind when figuring out where to best have an impact)

Two more caveats to my funding claim - first is my example. My goal was to get a PhD and do aging research, but that didn't happen. I had to stop after a BS due to my financial situation. Networks and programming were more of a hobby to me, but I had to pay the bills so things switched. If I had had the ability to continue pursuing biology I would have, so in my case financial incentives mattered a lot. I have also met a handful of other people in my career who went from biology to computer science for similar reasons. So while I am only a sample size of one, and my experiences are very anecdotal evidence, it does seem to me that if there was more money there might be more biologists.

The second caveat is that if a rich country like the US really wanted to do something, it could fund it massively. The fact that the private sector has had to take the reigns on aging research is a symptom of ""average"" citizens not caring about curing aging. We spend a good amount of our tax dollars on cancer and HIV research (to name a few), and a ton of tax dollars on things like the military, but extremely little on aging. If we as a society decided we wanted to cure aging, a government could fund that pursuit in a way that makes the private funding of Calico, Human Longevity, SENS, etc... seem pitiful.

An example of the power of society backing research in biology on a massive scale is embryonic stem cells (ES). When human ES were isolated in 1998, we couldn't deny the huge potential of ES but there were ethical and practical issues to having the source only be from an embryo. The ethical concerns of society pushed governments into funding a solution. Cell differentiation is incredibly complicated, perhaps even more complicated than aging itself, but in less than a decade a team from Japan had found a way to turn human skin cells into pluripotent stem cells (iPSC), effectively ES without needing the embryo. That is what we need for aging research, a societal push so massive that governments fund aging research at the same level as they did stem cell research. If anything would have an impact on aging research, it would be finding a way to evangelize at this level.

I am actually in a similar situation as you find yourself, albeit I am a bit older, which is one reason I bothered to reply. While my career has been great, I am looking to get back into biology in some way in the next few years. I have spent the last couple years trying to answer the questions you are asking, ""where can I have the biggest impact?"" I believe small amounts of funding increases won't do much, but if a society would choose to make aging research a priority that would change everything. However evangelism of that level is daunting and could be fruitless and I haven't found a compelling path forward (how do you even begin to get a society to care about something like this? how long will it take to do so? a generation or more? etc...). So I still haven't figured out exactly how I'll get back into biology and help with aging research, but hopefully some of my ramblings will help you on your path.

&gt;Basically the biggest question on my mind is if I should dedicate to high level attempts to improve the funding in aging research, or become an individual contributor and add myself to the talent pool. It is difficult for me to pinpoint my existing knowledge which area is in most dire need.

So the TL;DR of my thoughts above would be that unless you feel you can influence the government of an advanced nation into funding a substantial aging program, I don't think high level attempts to improve funding will have the impact you are looking for (despite the need for funding). As an individual contributor it is hard to tell. You are going about researching things the right way, trying to see what is being done and what might be the most promising avenue, but science is very much full of serendipity rather than a clear path to discovery (one reason it doesn't lend itself to a VC model of funding). You could end up playing a minor role, or you could stumble upon a discovery that changes the game, having a gigantic impact. Going into direct research might take you a decade of your life to get there, but doing something in computational biology or data science might be a direct jump for you. In that case, you might also be able to keep your salary (although I can't speak for stock options, quarterly and yearly bonuses, guaranteed annual raises, and all the other perks of working for a SV tech company).

&gt;There’s also people constantly discussing entrepreneurship, and hence there’s the low probability route of going for a standard tech startup route with a few peers, succeeding, then using the payoff to donate to research, fund awareness, etc. Essentially try to become a significantly less stingy Peter Thiel, as you brought up.

I'll end by saying this could be a good path. You are only 23, you have some time. My advice (having gone through a few failed startups myself) is to have a clear plan regarding how much you plan on making to donate, how many years max you are okay with spending to get there, what to do if the startup fails before that, and what to do after you succeed. You can also spend the time building your company doing more research in aging and biology and keeping tabs on the field, further refining what you will do once you have the cash to fund something (you'll only have so much time, a startup generally consumes your life). This is, more or less, the path I kinda tried to take. It didn't work out for me, but it may work for you.",1,1518809417,longevity
73,plainfacedhunchback,"But isn't all disease merely a symptom of aging and decay? If 70 becomes the new 30, so to speak, then wouldn't 70 year olds be having the same diseases as typical 30 year olds?",2,1508109028,longevity
74,vardarac,"That's just it, they didn't. What the press (hopefully not the researchers themselves) call aging damage is really just the symptoms of a missing gene that mimick the symptoms of aging damage.

Edit: Removed poor analogy. I think it's better thought of with a hypothetical example. If you induce insulin resistance by overfeeding a mouse, then stop overfeeding it and watch it return to normal, you haven't reversed the process that causes insulin resistance in old mice. You merely fixed an unrelated problem that causes the same symptom.",2,1504625656,longevity
75,Sanpaku,"Most chronic, non-communicable disease is attributable to lifestyle factors (esp. diet and exercise) that aren't significant parts of medical education. Most treatments offered for these diseases by medicine are either purely palliative, focused on coincident markers rather the disease process, or only have potential to retard, rather than reverse, disease progression. The long-term adverse effects of chronic pharmaceutical interventions for chronic diseases aren't seen in clinical trials, and pile up as additional drugs are prescribed to relieve the side effects of others. Randomized trials of some common surgical interventions have demonstrated poorer hard-outcomes than more conservative treatment, but carry significantly higher risks. When doctors go on strike, [mortality declines](http://booksc.org/book/13656488/ace460).

When one goes to a doctor with a symptom of concern, they can address that issue, but regular physicals when asymptomatic are fishing expeditions for possible diseases, seeking prevention when prevention of chronic disease generally doesn't come from medical interventions.

I've ordered my own blood work, partly to discern whether my diet was causing deficiencies, and partly to motivate me to continue on my path. But I've no real interest in developing a relationship with my doctor. My mother has seen an internist roughly twice a year for decades, is on a dozen prescriptions, and he never told her how to change her lifestyle to resolve her issues. I've seen the side effects of her medications (lethargy, repeated infections, etc) and lifestyle, but as someone without the requisite letters behind my name, no amount of peer-reviewed literature will change her mind.

 ",3,1503687448,longevity
76,bzkpublic,"Funny thing about this is ... let me post a quote from a conversation I had with Vijg months ago.

&gt;First of all, I would never advocate stepping entirely out of anything. We can never predict scientific or technological progress so we should continue to experiment. 

So, Olshansky is not only putting words inside Vijg's mouth, it's the complete opposite of what Vijg thinks on top of it.

People need to understand, we are leading an ideological Cold War at the moment. If you want to make a difference, if you want to live longer, and most importantly if you want to ACTUALLY be healthy regardless of how old you are - then take our side and promote the debate. 
Otherwise, it's highly doubtful your lifespan and healthspan will differ from the ones of your grandparents. The mainstream is not interested in advancing healthcare. They only exist to sell expensive, useless, symptom hiding drugs.

This is a reality you need to wake up to.
",3,1499337154,longevity
77,[deleted],"so you don't think we should advocate to other people because that would be too pushy but banning people from healthcare for not joining our minority group? What i'm reading is totally backwards. The entire point is to go against symptom treating and you think it will end up with symptom treating. You don't think we should ""push our agendas"" but we need to make our stance recognized and accepted? Same thing. What matters is stem cell research, clearing senescent cells and crispr. That's the most important thing. Everything else is irrelevant!",0,1494850657,longevity
78,peacebypiecebuypeas,No. The plan is to create therapies to undo the damage that the body does to itself over time. Frailty is simply a symptom of that damage.,3,1487782555,longevity
79,Jnendy,"Telemere shortening is more a symptom, IMO.  I was reading recently about the depletion of stem cell reserves.  In an old person, for example  it mentioned something about bone marrow stem cells being down to about 1/5 of peak levels during younger years.",2,1484548441,longevity
80,Ballaticianaire,"I just think you fundamentally misunderstand. It's obviating the problem, it's totally distinct from only treating the symptom, it actually treats the root cause (the damage itself), however, it doesn't preclude the damage from happening, so in that sense it's not causal. To the latter portion of your post, I'm making a gross oversimplification, but in fact, I don't. That statement is accurate for most of the biggest components subserving the aging phenotype. ",1,1482777789,longevity
81,Nathaenel,"&gt;But a counter-point to my pessimism though is that authoritarianism seems to be correlated with disease prevalence. 


Very funny correlation error..

Maslows pyramid: First layer, physical needs. You dont think about freedom of press or stuff like that when you are starving. 
Diseases are just a symptom of the lack of basic needs.


The only reason people have ethics/morals is a certain amount of wealth. High average wealth makes the best societes *concerning ethics.*",1,1482606198,longevity
82,EquipLordBritish,"I'm not saying this therapy is bad, but I do think the article oversells the scope of the treatment.  Aggregates in the cell are often the cause of some cellular process that has gone awry.  This treatment will help with the symptoms, but it will not address the cause.  DNA damage isn't the only symptom of aging, but it is the most important cause.",-1,1479753956,longevity
83,TranshumanTees,"I posted the article to r/biology and it got a rather interesting reply from someone there who mentioned that plaques may not be the problem but a symptom. I think it was someone who researchers Alzheimer's too.

They suggest I look into ""amyloid beta oligomers"" but I haven't had a chance to yet. They said they believe they could be the main problem/cause.

Kinda put a bit of a downer on the article, but we'll see what happens I guess! The fact it should be getting trialled is certainly positive.",2,1468793943,longevity
84,Positronix,"Your statements seem manipulative.  I'll go through them:

&gt;Can you please explain what makes it a shit post? A lot of time and effort went into it and I'm not sure I understand the hostility.

Either your barometer of ""a lot of time"" is skewed, or you are lying and hoping being polite will cover yourself.  The statements you made are shallow and mostly bullshit, and do not give any tangible advice to those who would seek it.  It's just positive reinforcement.

&gt;You quote the part of my post that says we give people what they want, but that's true of any business.

You know what I mean.  Stop dancing around the truth - selling hope is morally wrong and the reason it is morally wrong is because it distracts you from the truth.

&gt;Sorry, I didn't realize peer-reviewed articles were the only acceptable content here.

If only.  But we have places like /r/gerontology for that.  This sub is 90% hope articles and I tolerate it because it's a symptom, not a cause, of the current climate of antiaging research.

&gt;No wonder the longevity movement has so little funding and isn't moving very fast.

No.  Stop being manipulative.  The slow movement and lack of funding is due to false info and hope being peddled.  Nobody wants to fund snake oil.

&gt;only one type of person this community accepts, and it's certainly not the general public

As if you know what the general public is like?  Most people (I suspect all people) want to live forever.  But most people can't tolerate bullshit for very long.  It has become my opinion over the years that the 'general public' is much smarter than you give them credit for.

&gt;But as always I'm open to other points of view.

It really doesn't sound like you are.  You're trying to cloak yourself in irritating politeness while dancing around criticism of your low-effort post.",1,1468698195,longevity
85,SLO_Chemist,"Some thoughts on the aging research field:

* It doesn't really matter if we call it a disease, a set of diseases, or something else. We want to be able to control / slow down / reverse it. The Holy Grail, the Fountain of Youth, Philosopher's Stone... For thousands of years we have been obsessed with solving this problem. 

* chronological age is how old you are. ""biological age"" is a metric we'll need in order to show that age reversal therapies are effective... In other words you have given your therapy to some mice, and not to control mice, how do you show that the exp mice ""got younger"" (lifespan is a measure of longevity, but aging is more complex than just how long you live. Also, that's  a VERY long clinical trial when it goes to humans).

* so people have used many metrics to measure ""biological age"" (telomere length, methylation, NAD levels, etc.) but there's not a clear cut, agreed upon way to do this. 

* there is also some debate as to whether aging has a root cause (like a master regulator set of genes) or if it is many different processes that happen somewhat independently, this is important to know if we want to modify the process with a therapeutic. 

* there will be small molecule (drug) and genetic (gene therapy) strategies to reverse or delay symptoms of aging. These have different considerations in terms of one-time treatment vs. Continuous treatment, who can benefit from it, etc. 

* it is technically possible to engineer the engineer the human germ line (modified humans will reproduce, pass on modified genes), this raises ethical, legal, social questions that are by no means settled yet.

* One degree safer (more likely to be approved) would be modifying genes of adults but not their germ cells (modified genes aren't passed on). This would be a gene therapy, not many are approved today, but thousands are in clinical trials. 

* On the other hand, once a small molecule aging drug gets approval, that is a more simple process 

* if a master regulator is responsible for the decline in many areas of health associated with aging, then maybe there will be a holy grail drug that reverses the whole process. More likely, in my opinion, is that we will solve each symptom or set of symptoms (muscle mass, wrinkles, bone strength, many more...) separately ",5,1466936657,longevity
86,Yosarian2,"Ah, I see what you mean.

Still, if the symptom of a disease is what's going to kill you, then it's totally reasonable to treat that symptom directly.   And in this case, it seems like the high blood pressure itself is what's going to directly kill you, even though that's likely being caused by plaques on your arteries or whatever.     ",1,1442103244,longevity
87,MaunaLoona,"Thanks for the summary even though I read the article, but that didn't answer my question.

For example, the body raises its temperature when invaded by a foreign agent such as a virus. This helps it fight the disease. The fever is a symptom and is intentional. There are drugs to reduce fever, but they might be diminish  the body's ability to fight the disease.

Likewise, I suspect people have high blood pressure for a reason -- it could be the body's response to conditions such as partially blocked arteries or not enough blood is getting to the brain. Reducing blood pressure without treating the underlying disease might be deleterious.",1,1442099271,longevity
88,MaunaLoona,High blood pressure seems like a symptom not the disease. What function does it serve?,2,1442096206,longevity
89,ahfoo,"Lot's of correlations but not too many clear causes being teased out here. The studies that show correlations between ""excessive"" sleep and morbidity have a huge barrier to overcome in showing that it is the sleep causing the morbidity and not that it is a symptom of some other underlying issue. ",1,1441286376,longevity
90,dz93,Poverty is the most deadly disease in existence. Not only does it cause you to not foresee future events based on current actions but it also causes you to recklessly consume every resource in your sight without a single thought about it. The disease has also been shown to cause parents to stop caring for their children. They typically develop the idea that higher education is bad. As a final symptom of the disease it also creates a huge urge to find and use the hardest drugs they can causing them to sell and steal anything in sight to get money for the drugs. Poverty is a horrible disease. Worse than dementia or anything else. ,1,1434543664,longevity
