,author,body,score,created_utc,subreddit
0,Donovan200,"The report released by the House of Lord earlier this year that recommended increasing funding for research into aging appears to have been heard by the government.

The next step in my opinion is that they allow clinical trials directly targeting aging, as recommended in the report.  
  
No matter what they call it, whether it's as a disease / modifiable risk factor / treatable medical condition / comorbid symptom or whatever ... it doesn't matter, as long as we can target it to prevent or treat several illnesses at the same time.",12,1625808629,longevity
1,kpfleger,"[https://twitter.com/KarlPfleger/status/1404105863934189571](https://twitter.com/KarlPfleger/status/1404105863934189571)

FDA forces RTB101 to use patient symptom report not hard bio endpoint of lab-confirmed infection so trial fails. Then FDA approves aducanumab based on hard bio endpoint of Aβ clearance despite lack of improvement in patient symptoms. Seems inconsistent.

There's disgruntlement w/ both decisions, but even w/o arguing against either individually it's easy to argue the inconsistency of symptoms vs underlying bio is problematic. If Aduhelm is okay based on only underlying molecular bio evidence, resTORbio should have that chance too.",10,1623602482,longevity
2,proteomicsguru,"It’s not going to work. Maybe there will be a small slowing of disease progression, but amyloid-β aggregates aren’t the cause of Alzheimer’s disease, they’re a downstream symptom of a more fundamental pathology. Exactly what that pathology is, whether it’s a proteostasis issue, ROS issue, mitochondrial dysfunction, membrane lipid biosynthesis disruption, etc. is not currently known. 

I hate to pour cold water on this, because I know how urgently we need *something* to treat AD. I just think that the community might be setting itself up for disappointment with this particular agent.",17,1623121514,longevity
3,SaltOfGuthix,"I’m incredibly sceptical of the continuing obsession with plaques.  Insanity is doing the same thing over and over again and expecting different results, and all that…Plaques are more likely to be a symptom (albeit a symptom that can add even more cell stress into the mix) of the pathogenisis, than they are the cause, in my humble opinion.",8,1623110073,longevity
4,alien_tripp,"""underlying cause"" i think we can all agree that amolyid beta is not the cause but another symptom in an whole cascade..",9,1623084165,longevity
5,ExperimentsWithNoo,"&gt; He believes senescent cells are more just a symptom rather than one of the causes of aging.
&gt; 

That I think is common consensus now.
They do contribute to aging by secreting too much SASP - but they themselves are not the 'initiator' of aging.",4,1621813348,longevity
6,Takadeshi,"They tend to die from cardiovascular failure which is put down to ""pneumonia"". This is true for most people that live beyond 90, my personal thesis is that centenarians possibly have genes that help protect them against cancer, and then they get lucky in not getting heart disease and the like. But this cardiovascular isn't something ""different"", it's not a disease that can't be diagnosed, and in fact it's very consistent with the cumulative damage theory. After long enough, the cardiovascular system is simply damaged to the point where it can no longer function, and no available medicine is able to repair it. That explanation is very concise and in my view seems to reflect the facts. It's not really true that they don't have symptoms leading up to it; aging itself is the symptom. Most people in their 80's and older have breathing difficulties, muscle degeneration, cognitive decline, high blood pressure, i could go on. Again, there is nothing magical which kills people off if they happen to live beyond 100, they die from the same thing as everyone else; cumulative damage.",1,1620837222,longevity
7,lawless_c,so would blocking this slow aging? or is it just a symptom of aging?,2,1620750815,longevity
8,redpills1,"""life extension treatment"" can be many things. Every life saving treatments can be called ""life extension treatment"". There several kinds of life extension treatments, one is focused on treating diseases and will probably only give us a modest rise in life expectancy.

There are life extension treatments that will focus on giving us small improvement in some downstream symptom of aging like senolytic drugs that kill senescent cells. Those treatments will probably won't give us more than a modest rise in life expectancy.

And there is a life extension treatment that is focused on complete rejuvenation and eliminating chronological age as a factor for our health and will make people pretty much immortal.

The one that is focused on complete rejuvenation will probably only be available for rich people or people who saved enough money for it. It will be expensive and many people(especially those who are poor or live in poor and undeveloped countries) won't be able to afford it. Some people want to believe that it will be free or cheap but it seems like over-optimism(and I am an optimist myself). Many people can't afford relatively simple life saving treatments. So don't expect complicated treatments that make a serious change in your entire body(from old state to young state) to be cheap and available to the masses.

Don't try to save the world, focus on saving money and/or increasing your income as much as possible so when complete rejuvenation treatments will be available you will be able to afford it.",1,1620071015,longevity
9,bzkpublic,"Most people tend to forget, seniors become immobile not due to a lack of discipline, but due to ... sarcopenia,  arthritis and osteoporosis.  
You literally want to treat the condition with the symptom.

If a 40 year old is immobile, that's different. But at 70 and above you can't expect a granny to just ... walk it off. That's not how aging works.",1,1617653248,longevity
10,throwaway12389300000,Yeah that too... we currently do not have solutions for even the simplest of things in health care. Best we have are symptom blockers.,1,1612949634,longevity
11,StoicOptom,"I'll be honest the mechanism of action of this drug is incredibly lame...

It is much the same as the traditional strategy with medicine: the pitiful 'let's treat the symptom' approach to a single age-related disease.

I think Novartis' EV06 is currently in P3 clinical trials and its mechanism actually attempts to address crosslinks to soften the lens and improve its pliability. At least this would be an example of a regenerative strategy, and is more in line with /r/longevity",7,1607165203,longevity
12,LzzyHalesLegs,"Symptom-based focus makes more money, plain and simple. It’s easier to make money off of selling a silver bullet that “saves/cures” people rather than selling to people “eat right, exercise, maybe take supplements” but that’s mainly because there’s not so much a silver bullet in preventative medicine yet, like a metformin but better. And we’re not going to have that for a while because that research isn’t being funded as much because there’s less hope for ROI, so less progress. There is progress though, make no mistake.",2,1606024713,longevity
13,wriggleriggle,"My personal opinion is that this is is a symptom of capitalism in general. The entire system has flaws.

Nobody is trying to cure cancer. What they want to find is a product that they can profit of handsomely and copyright, license, and profit for decades. It is whack a mole, because they are hunting for their gold mine, not trying to advance the science

Similarly, no one is trying to prevent aging. What they want to find is a product that they can profit of handsomely and copyright, license, and profit for decades.

If there are products that work but are not profitable, such as quercetin and dasatinib. No one will care. No one will invest research into it.

Obviously there are exceptions in general. But that's the way the system works in general.",11,1606024622,longevity
14,beefytime,"Hoping not to sound too preachy here, because I’m so thankful for all the amazing research going on. But anti-aging and longevity as a field suffers from the same whack-a-mole medicine as oncology. The hallmarks of aging have created a symptom-based focus while ignoring prevention and causation. I’m not saying a unified theory of aging that exists, but the problem is no one is looking for it.",13,1606021060,longevity
15,uclatommy,"Why do people keep fixating on telomeres? They are more of an indicator than a driver. Fix the underlying cause, not the symptom.",1,1605897309,longevity
16,mrmudzi,"The tools are not in the hands of the populace.

I have to fight my PCP just to get a freaking blood lipid panel.  There is so much medical gatekeeping around access to data on our own bodies, data that is essential to understanding how each of our bodies individually responds to various diets and physical activity regimes.

That doesn't even get into the psychosocial factors that trap people in food deserts where they are surrounded by industrialized, non nutrious food, violent crime, and the stress of broken homes.

We are subject to a healthcare regime that actively disempowers us from actually managing our own health.  One that then goes surprise pikachu face when people with nonexistent health education, pumped with opioids due to symptom- focused healthcare end up fat, depressed, and drug addicted",1,1605603770,longevity
17,kommiekaze,"maybe fix the issue first instead of a symptom of it? stress wont only affect your hair, it will destroy you from the inside out and make you age a lot faster.",1,1604768151,longevity
18,clinicaltrialist,"I won't try to answer whether aging is a disease or not because different people mean different things when they say aging.

But I can tell you what a disease is. A disease is an artificial intellectual construct that we (mostly doctors but sometimes others) create so that we can have a handle for a set of symptoms and signs. There is no a priori definition of pneumonia or diabetes for example. Doctors came up with those definitions over time through pattern recognition, and now you have committees of academic physician arguing endless about whether the definition of diabetes should encompass blood sugar of 99 or 100.

As an analogy, disease boundaries are similar to boundaries of countries. Generally, they follow geographic boundaries like rivers, but they don't always, and they change over time.

There used to be disease classifications that are no longer used. Consumption. Melancholy. Hysteria. There are new disease classifications that didn't exist before. Depression. Restless leg syndrome. Don't get me wrong. The patients who have those symptoms and signs always existed. The way we slice and dice the symptom constellations have changed over time.

Why do those definitions change? Partly it's because we understand biology better so we can recategorize them, much as taxonomists use DNA data to re-arrange species.

But, most diseases are categorized by whether they respond to a particular therapy or not. Heart attacks were divided into Q-wave and non Q-wave MIs when tPA turned out to work for one but not the other. Then NQWMIs were combined with unstable angina into acute coronary syndrome when they were found to respond to similar therapies.

Doctors are pragmatic people. If subtle dissection of disease categories won't change the treatment modality, we don't have time to sit there and use up mental cycles to do that. (Except neurologists, they love doing that, perhaps because for the longest time they didn't have any therapies that worked).

But the core of your question is valid. Whether something is viewed as a disease or not and what kinds of disease it's considered to be does depend partially on its frequency.

For example, phenylketonuria (PKU is a disease where some people who lack a particular enzyme to break down phenylalanine) would not be considered to be a disease if everyone lacked that enzyme. If someone died from eating phenylalanine, it would be seen as a poisoning.

As another example, if almost everyone had CCR5 mutations, then people who didn't have the protective mutations and contracted AIDS would not be considered to have an infectious disease but rather a genetic disease.

Thanks for coming to my TED talk. Now I will hand it over to my epistemologist friends.",1,1602345561,longevity
19,Bluest_waters,"&gt;  Does it clean your arteries but clog up your brain and cause dementia?

Interestingly it boost macrophage activity. In the brain the microglia perform the same function and disabled microglia are a symptom of dementia. 

So if this product goes past the BBB and boosts microglia just like it boost microphage in the rest of the body then it may actually have an anti-dementia effect. 

Of course then you will have a bunch of nanotubules floating around your brain. Who the fuck knows what that will do?",1,1601146696,longevity
20,StoicOptom,"&gt; However, the main issue I encounter when talking to clinicians is that such a preventative approach (i.e. medicalising the general public with senolytics, or what have you) is extremely unappealing.

&gt; A major argument they rely upon is that investing into this preventative approach means taking money away from cancer/heart disease research etc. and therefore harming patients who are sick *today*.

Again, this is a false dichotomy that is incredibly revealing of the sheer ignorance of the physicians you talk to. This is the main problem with the entire apparent/alleged philosophical argument. 

Remember that clinicians very rarely have a strong grasp of basic science, especially when it pertains to aging. Medicine literally has a specialty called geriatrics, where they essentially treat symptoms, remove medications to reduce polypharmacy (another symptom of the failed single-disease approach to medicine) and are nearly completely ignorant of aging biology despite literally specialising in 'aging'. Most of them don't even *try* to understand aging as the root cause of disease and develop therapeutics to ameliorate the comorbidities of age - thankfully that is changing with the next generation of geriatricians - although very slowly.

You would be better served talking to clinicians who actually know about the basic concepts of aging biology, physician researchers like Nir Barzilai or John Newman are great examples.",6,1600430146,longevity
21,pre-dental23,"Oh yeah definitely I mean even among men who don't have MPB, they still tend to lose hair once they grow old, both men and women. I assume that's just a symptom of aging. 

However I have never seen a bald, or even balding woman in her 30's-50's. Maybe it's just not noticeable to men, because when I think balding I think receding hairline, being able to see the scalp easily etc. I have never seen this on women before. Maybe they are wearing wigs I'm not sure. 

I'll say this though, it's much easier being a completely bald man than a complely bald woman.",1,1596034896,longevity
22,V12AventadorV12,"But that's not entirely accurate. 

CVD and cancer are symptoms of aging, not the root causes. Of course curing those won't cure aging. Another symptom of aging like alzheimers will kill you. 

If you actually treat the root causes of aging, such as fixing genomic instability and removing senescent cells etc. That stuff could be additive",1,1593115167,longevity
23,StoicOptom,"In the PR I linked, there are some encouraging signs with consistency b/n P2 and P3 with [lower coronavirus \(lab-confirmed\) symptoms](https://www.globenewswire.com/NewsRoom/AttachmentNg/2efab205-5689-453e-b2c6-5bdb006d89d4) and also in [severe coronavirus](https://www.globenewswire.com/NewsRoom/AttachmentNg/4e5cdc45-cc2b-4d9a-815f-4907690bb06f).

Broadly, this seems to hold for the other lab-confirmed viruses which Joan Mannick was referring to in contrasting her complaints with the P3 trial's primary endpoint 'any RTI symptoms' vs the P2 trial's 'lab-confirmed RTI symptoms'. Clinical efficacy can vary depending on the virus, so if only their coronavirus results replicate with their Covid trial it will be an approvable drug. 

If RTB101 MoA is related to immunosenescence we should reasonably expect that RTI incidence of most virus strains would be lowered as well as reduced symptom severity.

This is still not the full data and I hope that gets published at some point so we can have a better idea of what's going on with their drug.",1,1590715467,longevity
24,Black_RL,"Yes, but death is so different that I didn’t think it would fit any, therefore my question marks.

Doing some digging now, can’t find symptom or signal, I already find state.

Interesting nonetheless.",1,1590072778,longevity
25,rhiptel,"A symptom is any subjective evidence of disease, while a sign is any objective evidence of disease. Therefore, a symptom is a phenomenon that is experienced by the individual affected by the disease, while a sign is a phenomenon that can be detected by someone other than the individual affected by the disease.",1,1590072663,longevity
26,rhiptel,"Death is a sign, not a symptom.",1,1590072212,longevity
27,Black_RL,"Because it’s caused by other diseases? It’s a symptom, not the disease?

The problem is that it’s the ultimate symptom.",1,1590065909,longevity
28,thestrangescientist,"It’s not going to work.  Beta-amyloid is a late-stage symptom, not the cause!  It’s for similar reasons that biologics including antibodies and antibody derivatives against beta-amyloid have failed.  

Amyloid precursor protein is cleaved at the plasma membrane, yielding beta-amyloid that falls off the cell, and the remaining intracellular bit falls into the cell.  Researched used to think the outer part, which comprises beta-amyloid, was the pathogenic substance.  But as it turns out, the inside part is just as bad - once it’s released from the membrane, it goes into the nucleus and acts as a transcription factor to turn on apoptosis (cell suicide) genes.  

Source:  I’m a PhD student studying the cell biology of neurodegeneration.  I would’ve included references, but I’m honestly too tired~",10,1589246567,longevity
29,Immortal-Rumor,"My guess is that it’s because people only care about what’s immediately impacting them and focus on other priorities. If a person is struggling with cancer, they don’t care about the cure for aging even though cancer is a symptom of aging and would benefit from that research. 

Blissful denial of aging and it’s impact appears to be the status quo for how people cope with mortality. 

I believe that the answer to this is education, improved marketing/messaging by companies focused on longevity, and maybe even some sort of partnership/organization between companies focused on these topics.",1,1585592026,longevity
30,pravincomapny,"Its a ridiculous paradox. Without the money, we can't actually work on the root cause of these diseases like poor eye sight- ageing and without solving the symptom, we don't get the money.",1,1585591383,longevity
31,TheFeshy,"I'm a type 2 diabetic, so... there's no giving up on it for me.  Diarrhea as a side effect is still better than kidney failure, blindness, loss of limb, and death.

That said, I have heard that the extended release is better for some people, and others show improvement after four to six weeks.  Alas, some people never improve in that symptom even with extended release, taking it with food, sticking to it for two month, and whatever other recommendations there are out there.",1,1585011182,longevity
32,anotherthrowawaykek,"Yeah but is the damage 100% responsible for aging ? I worry they're falling in the same trap that other researchers fell into while trying to cure Alzheimer. Everyone noticed there's amyloid plaques in a brain afflicted by alzheimer so they decided to target it and remove it. They were successful in removing the amyloid only to find out the disease does not stop progressing and they're not getting any results. This happens because the amyloid plaques are a symptom and not a cause of the disease, they appear *because* the person has alzheimer, it's not responsible for causing it. 


Cue to anti-aging research, they're studying old cells and notice accumulation of damage. Did anyone investigate if the accumulation of damage is a symptom and not the cause of aging? What if the cell starts losing its function the older it gets and because of that, damage is starting to accumulate as a consequence? Removing that damage wont make the cell work better, the damage they observe is only a symptom in this case, and removing it wont solve anything. By analogy think of an engine that was broken in half so now it's abandoned in a warehouse and collecting dust. Researchers see the engine and decide the engine doesn't work because there's dust on it, so they start removing the dust and then wonder why it wont start.",1,1582902435,longevity
33,mvadovic,"In my humble opinion - Amyloid-beta is a symptom, not a cause of alzheimers or those other diseases mentioned.",1,1582729720,longevity
34,Nukatha,Death is an untreatable symptom.,1,1581880426,longevity
35,StoicOptom,"Exactly right, it's a symptom of how broken politics is - there is a woeful lack of planning for the future even though the trajectory of an aging population is clear. 

We can only hope that some of these therapies pass through PIII clinical trials quickly or society is looking at an economic collapse of epic proportions.",1,1580599119,longevity
36,Rosebud123456789,Trump is a symptom.  That he has so many supporters is scary. Lord help us!,1,1578957833,longevity
37,travis-42,"I agree, but I’m actually surprised that as a symptom they don’t seem to matter. Like, these plaques sitting around in the brain don’t have bad side effects? In mouse models they seemed to matter. My prediction was that the amyloid reducing medications wouldn’t cure/stop Alzheimer’s but would reduce some of the symptoms. Unless the studies or medicines weren’t good, it seems like the amyloid plaques basically just don’t matter.",1,1577928078,longevity
38,akula1984,You get the feeling the plaques are a symptom of the problem not the cause,1,1577927755,longevity
39,beetard,"So more people are living past 100, but average age of death is going down. The younger generation is predicted to die younger then their parents.
 https://www.bloomberg.com/news/articles/2016-10-28/americans-are-dying-faster-millennials-too

I think some people living longer but most people dying younger is a symptom of wealth inequality and lack of healthcare for younger people.",1,1577367155,longevity
40,necropantser,"OK /u/sand_fox, I think I understand your thesis.  

My comments are as follows:

* NF-kB is primarily involved in upregulation of inflammation.  You seem to be advocating that the causes of ageing are essentially the result of increased chronic inflammation.  If that were the case, why don't people who have broken inflammatory systems stop aging?  Why don't anti-inflammatories like TNF-alpha antagonists or prednisone show a stronger propensity for extending life.

* I think evidence better suggests that chronic inflammation is a *symptom* of aging, not the cause of it.

* Regarding HERV-K, I view the activation of these endogenous retroviruses as an inevitable outcome of the loss of epigenetic inactivation and thus a symptom of the real cause of aging.  Additionally, they may be contributing to the aging itself when they become highly active and induce DNA instability.  Their interaction with NF-kB is likely an evolutionary adaptation to help promote their own replication.

* If ERV's are the cause of aging, do you postulate that using some technology similar to CRISPR to destroy the replication abilities of the ERV's would result in a mouse that did not age?  Could a mouse egg be produced that did this...resulting in an immortal mouse?  I am skeptical, but I think such an experiment might show interesting results.",1,1574452649,longevity
41,Shizuka42,"Might be just a symptom.

 Bodies of people who don't take care of them selves tend to degrade faster which leads to slower walking.",1,1574170838,longevity
42,CreativeLadder,It's best to track your symptoms earlier on with a heart failure symptom checker like this one [https://www.heartfailure.com.au/#keeping-track-of-how-you-feel](https://www.heartfailure.com.au/#keeping-track-of-how-you-feel),1,1573774516,longevity
43,Puzzleheaded_Animal,"Frankly, I'd say this is a consequence of the broken concept of medicine right now. Rather than treat the underlying problem of ageing, we try to treat every symptom individually, and there aren't enough treatments to treat all of the symptoms.

As for the financial perspective, rejuvenation is likely to be cheaper than continually treating new diseases as people get older. But one person's 'wasteful spending' is another person's income, so many will oppose any such change in spending.

Either way, if I ever get to the point where my brain is mush in a dying body, I'm gonna take a ride on an ice floe to meet the polar bears.",1,1573066685,longevity
44,sophlogimo,"&gt; Tried a very high dose in January and noticed nothing.

You would not notice anything from a single dose - you would have to regularly take it for a long time to notice any (minor) effects.

But senolytics are probably just attacking ONE symptom of aging anyway. We need something more profound. No need to take any risks now, unless you are already suffering severe aging effects.",1,1568859250,longevity
