,author,body,score,created_utc,subreddit
45,Ajax_A,"[dementia is a catch-all term](https://www.alzdiscovery.org/news-room/blog/dementia-alzheimers-disease-whats-the-difference) based mainly on the symptoms, but not the underlying causes. This makes any answer to this question a bit less precise.

[NADH seems to help with Alzheimer's related decline.](https://www.ncbi.nlm.nih.gov/pubmed/15134388) [NR seems to help with the Alzheimer's analog in mouse models.](https://www.nih.gov/news-events/news-releases/compound-repairs-neurological-damage-shows-cognitive-benefits-mouse-model-alzheimers-disease) If I was looking for a band-aid fix, I'd be investigating NAD supplementation of some sort.

As for curing dementia, it's a disease of aging, so trying to cure it is playing whack-a-mole with another aging symptom. That's usually not a successful game, at least not over the long haul. My guess is that we won't have dementia properly licked until we have therapies to undo the age related damage causing it in the first place.",1,1567971431,longevity
46,Person_On_The_Web,I think the good who die young only do so because of the men contain more rot than their own bodies can contain and so they spread their disease to the next generation and the next. To die young is a symptom of living in an evil world.,1,1566618484,longevity
47,elcric_krej,"meh, not really, it's focused on insulin producing cells and vascular shunts... it will more likely help people that should die in their 60s live in their 80s. Which, don't get me wrong, is ethically amazing and all, but it's not really longevity related.

&amp;#x200B;

Organ replacement fixes a ""high level"" symptom, longevity is about treat ""low level"" problems.

&amp;#x200B;

Even on a ""high level"", longevity in those that live a healthy lifestyle usually boils down to brain, the lymphatic system, bone marrows and the thymus... and helping those regenerate is not matter of having the correct lattice on which to grow tissue to then insert in the body.

&amp;#x200B;

Again, not saying this technology isn't amazing and super helpful and I'm fucking excited to see it in action and I think it can lead into other great things, the researchers working on this should be praised and they deserve every bit of money and fame they make from it, but it won't help those that reach 90 live to 100 and those who reach 120 live to 150.",1,1565589775,longevity
48,indoordinosaur,I believe the bone loss is more a symptom of hormones. Hence why it speeds up dramatically when women go through menopause and why men with low testosterone have lower bone density.,1,1563395014,longevity
49,eterneraki,"haha i didnt even mean that as an insult to docs, i just dont think the curriculum is focused on prevention as much as prescription. but that's a symptom of larger problems I suppose",3,1563147011,longevity
50,indoordinosaur,They should stop thinking of Alzheimer's as an independent disease and more of a symptom of aging. Its increasingly clear that Alzheimer's/Dementia is a result of the body's total system failure.,9,1563144714,longevity
51,SterlingVapor,"Yeah, that's something I'd like to do some further research on...they briefly explain it's caused by interaction between sympathetic and parasympathetic nervous systems, but instead of elaborating they justified it as a metric of aging by saying it predicts better survival chances in similar cancer patients, as well as being a general measure of health.

&amp;#x200B;

If I had to venture a guess, I'd say it means your heart is more quickly adjusting to the needs of the body, saving itself work and avoiding unnecessary wear on the cardiovascular system...or maybe it's just a symptom of physical fitness",2,1561375201,longevity
52,wearealonetogether,"Have you heard of [The Specific Carbohydrate Diet](http://www.breakingtheviciouscycle.info/)? My partner has Crohn’s Disease and follows this diet; he essentially reversed major damage to his colon and has remained symptom free by following it. He was even put under for surgery and given an epidural, but when his doctor went in with a camera he saw shocked to see that he no longer needed the surgery at all. I follow the diet with him and it has significantly helped issues I’ve had like persistent/unexplained joint pain and eczema. I’m in a Facebook group for SCD and there are many, many members with UC who follow the diet with excellent results. It’s definitely a major lifestyle change and can be a pain to follow, but I highly recommend looking into it if you aren’t familiar.",5,1561345422,longevity
53,monkeyboosh,"The unfortunate thing about studies like this is the fact that in humans it seems like runaway amyloid beta production seems to be correlated with microbes crossing the blood brain barrier. We have plenty of drugs that can stop amyloid beta production in it's tracks, but it seems like 20th century style ""treat the symptom"" medicine that is so prevalent today doesn't work.

Amyloid beta is most likely a red herring and only causes damage, but it is probably not the root cause of Alzheimer's in the first place. A critical piece of the puzzle is finding out why amyloid beta starts to form, which unfortunately is underfunded basic research.",1,1556868339,longevity
54,Vehks,"&gt;  age driven diseases

This is the operative phrase here.

I still stand by my statement. You have to address the cause, not the symptom. Alzhiemer's IS the symptom.

Th author himself also stated that aging is not classified as a disease and there in lies our issue. We are ignoring the cause and instead trying to treat the result and then become frustrated when no progress is made.",3,1556318280,longevity
55,72414dreams,"Yes, it could, but inflammation is itself a symptom with many potential causes. Chasing inflammation could end up like herding cats.",2,1556198530,longevity
56,Mazerrr,"Treating dry skin isn't necessarily just treating the symptom, the additional inflammation from cracked dry skin or low-intensity infections causes additional damage and stress to the stem cell populations regenerating the damage.  Mitigating this progressive damage over time is addressing the actual problem.

I agree that marketing a product could be an conflicting issue, but they did have to use something for the study. The citation explains their reasoning for choosing it and they will have disclosed any financial relationships since this is a scientific publication which requires that.",1,1552853190,longevity
57,kesbar,"""according to my study you should be putting this product on your skin every day for the rest of your life.""

yeah, thats not predictable.

even if the cream works, you're just addressing the symptom of the actual problem.",1,1552832951,longevity
58,shrillthrill,"Website: https://www.neotiv.com/en/

iOS: https://itunes.apple.com/us/app/neotiv/id1417115416?mt=8

Android: https://play.google.com/store/apps/details?id=com.neotiv.app


&gt; DW: Your company, neotiv, has developed an app to research neurodegenerative diseases in their early stages. You're also involved with the German Center for Neurodegenerative Diseases (DZNE). What's the aim of your app, and how does it work?

&gt; Professor Emrah Düzel: The aim is to improve the prevention of Alzheimer's disease in the future — that's our global aim. And one of the major hurdles there is that it's very difficult to diagnose, track, and monitor the disease. That makes it very difficult to recognize the early stages of the disease and start prevention in time.

&gt; The app is designed to track the cognitive performance of the participants — Alzheimer's patients and a control group — over a long period of time. Participants also have to answer questionnaires. And you're looking specifically at getting people, ""citizen scientists"" if you like, to track their cognitive performance, even when they've had a bad night's sleep, or they've got the flu. Why?

&gt; Well, first, we want [the app] to become a medical device at some point, one that has a strong basis in science, so that's why we have these ties to the German Center for Neurodegenerative Diseases. Then we also want to reach out to the public to inform and empower citizens, so that they know about the early aspects of Alzheimer's. And we want to empower science. One of the hardest aspects of Alzheimer's research is understanding the impact of intermittent health conditions on the main symptom of the disease, which is memory impairment.

&gt; There are so many intermittent and unpredictable health events that it's hard for science to know their effect. But you can't just have people come into a clinic when they've got flu.

&gt; How does your app compare to traditional cognitive performance tests, pen-and-paper tests, which, we've learnt, have issues, such as cultural biases or so-called learning effects, where if you know the test, you'll know how to answer, and that can skew the results?

&gt; Those existing tests were designed 30 or 40 years ago at a time when we didn't really know how the brain works. But now we have a very clear idea of where the disease starts in the brain and how it progresses. So we can design tests in such a way that they first address the brain areas that are affected initially, and then consider how the disease might progress. And that's what we've done. 

&gt; We've also designed the tests so that they can be used in many different countries, so that they don't depend on a [person's language skills]. 

&gt; The idea is that our app will give general practitioners (GPs) and other health professionals, and scientists, a probability as to whether a person has a form of Alzheimer's in their brain.
",1,1551353401,longevity
59,SnellYaLater,"Well not exactly brand new now, but this exists https://onlinelibrary.wiley.com/doi/full/10.1111/acel.12596

Also, we’ll have published lifespan data from the ITP 2015 cohort on MitoQ in a year or two. They just published the 2013 cohort paper last week, so we can expect the 2014 within a year (sooner if none of the interventions work) and the 2015 the year after (this cohort also is testing NR). My sense is that it probably isn’t doing anything, but we’ll have to wait see.

I’ll say it once, and I’ll say it again: the therapeutic window for CRISPR (and in this case mitochondrial replacement), is at the egg/embryo stage of development. CRISPR isn’t going to do anything for us now that we’re large multicellular organisms unless we’re talking about mitochondria in the eye or something. Much more realistically, we may be able to stimulate via drug the pathways that trigger mitophagy and other mitochondrial QC mechanisms, but it’s still largely unclear if this would be addressing a symptom or cause of aging.",1,1550934530,longevity
60,badgirlbandit,"Yeah! Thats why its so important to get treatment ASAP, but a symptom of the disorder is resistant attitude towards treatment (in many people), so then we tend to self medicate, further increasing brain damage, hit rock bottom, and finally admit meds may be not such a bad idea. And our lifespan is shortened by 9-20 years. If I remember correctly its because of tons of oxidative stress. But that part is a breath of fresh air because I feel like Ive lived 3 lifetimes already and am cool with croaking whenever. Im 26 but I think I definitelty look a lot older, in the bad way",1,1550192051,longevity
61,Geroscience,"Link to paper (paywalled): [https://www.nature.com/articles/s41591-018-0304-3](https://www.nature.com/articles/s41591-018-0304-3)

Abstract:

&gt;Neurofilament light chain (NfL) is a promising fluid biomarker of disease progression for various cerebral proteopathies. Here we leverage the unique characteristics of the Dominantly Inherited Alzheimer Network and ultrasensitive immunoassay technology to demonstrate that NfL levels in the cerebrospinal fluid (n = 187) and serum (n = 405) are correlated with one another and are elevated at the presymptomatic stages of familial Alzheimer’s disease. Longitudinal, within-person analysis of serum NfL dynamics (n = 196) confirmed this elevation and further revealed that the rate of change of serum NfL could discriminate mutation carriers from non-mutation carriers almost a decade earlier than cross-sectional absolute NfL levels (that is, 16.2 versus 6.8 years before the estimated symptom onset). Serum NfL rate of change peaked in participants converting from the presymptomatic to the symptomatic stage and was associated with cortical thinning assessed by magnetic resonance imaging, but less so with amyloid-β deposition or glucose metabolism (assessed by positron emission tomography). Serum NfL was predictive for both the rate of cortical thinning and cognitive changes assessed by the Mini–Mental State Examination and Logical Memory test. Thus, NfL dynamics in serum predict disease progression and brain neurodegeneration at the early presymptomatic stages of familial Alzheimer’s disease, which supports its potential utility as a clinically useful biomarker.

&amp;#x200B;",7,1548104137,longevity
62,Geroscience,"Link to paper (paywalled): [https://www.nature.com/articles/s41591-018-0304-3](https://www.nature.com/articles/s41591-018-0304-3)

Abstract: 

&gt; Neurofilament light chain (NfL) is a promising fluid biomarker of disease progression for various cerebral proteopathies. Here we leverage the unique characteristics of the Dominantly Inherited Alzheimer Network and ultrasensitive immunoassay technology to demonstrate that NfL levels in the cerebrospinal fluid (*n* = 187) and serum (*n* = 405) are correlated with one another and are elevated at the presymptomatic stages of familial Alzheimer’s disease. Longitudinal, within-person analysis of serum NfL dynamics (*n* = 196) confirmed this elevation and further revealed that the rate of change of serum NfL could discriminate mutation carriers from non-mutation carriers almost a decade earlier than cross-sectional absolute NfL levels (that is, 16.2 versus 6.8 years before the estimated symptom onset). Serum NfL rate of change peaked in participants converting from the presymptomatic to the symptomatic stage and was associated with cortical thinning assessed by magnetic resonance imaging, but less so with amyloid-β deposition or glucose metabolism (assessed by positron emission tomography). Serum NfL was predictive for both the rate of cortical thinning and cognitive changes assessed by the Mini–Mental State Examination and Logical Memory test. Thus, NfL dynamics in serum predict disease progression and brain neurodegeneration at the early presymptomatic stages of familial Alzheimer’s disease, which supports its potential utility as a clinically useful biomarker. 

&amp;#x200B;",1,1548100772,longevity
63,shrillthrill,"&gt; that you can't consider Alzheimer as simply a symptom of aging since most people age without Alzheimer's

I did touch on that when I said it was multifactorial.  

&gt; Multifactorial: involving or dependent on a number of factors, especially genetic or environmental factors.

People have different genetic risk and environmental factors.    So that's why people age without developing AD. 

Age is the greatest risk factor.  Things that go wrong in aging are hallmarks of AD (see citations).   Targeting the things that go wrong in aging for AD, may end up being beneficial to everyone if the damage is general enough.   The people who age without getting AD, may just succumb to other types of damage being before the AD-relevant decline becomes relevant for them at a slower rate.",1,1546337122,longevity
64,herbys,"All true. But that an illness becomes exponentially more frequent with age doesn't mean that it is the same as aging. It is still argued whether aging can be considered an illness, multiple illnesses or not an illness but it is easy to see that you can't consider Alzheimer as simply a symptom of aging since most people age without Alzheimer's and (AFAIK) for someone that didn't develop Alzheimer before age 90 is very unlikely to develop it even if they get to live up over 100.(please correct me if I'm wrong here). Curing Alzheimer is an independent objective to curing aging.",1,1546335106,longevity
65,herbys,Alzheimer is not a symptom of aging. It is its own illness.,4,1546231921,longevity
66,Monopreis,"Well that's nice but not nice enough. By doing this he's merely addressing a symptom of ageing. He isn't addressing ageing itself. So he still funds mainstream approaches. This isn't what we want here, not what humanity needs.",12,1546203991,longevity
67,zombiehoffa,"While I agree with you that this will likely be a problem, your solution won't be implemented because those old people will predominantly be super rich (at least initially). I know I would never give up my right to vote without a fight and if I have enough money to buy longevity treatments I expect I would be able to bring considerable resources to bear on your attempts to deprive me of my right to vote.

&amp;#x200B;

Devil's advocate opinion though:  Is lack of plasticity in opinion a symptom of age or a symptom of aging?",1,1543564884,longevity
68,xytrooo,"Its a worthy pursuit, just not as worthy as someone discovering a way to train faster or cure some symptom. ",1,1542280410,longevity
69,John_Schlick,"I've written a piece - in this forum, on the 4 epochs of longevity.

I think the science is slowly forming a consensus about the root cause of aging, and as far as I know now one is yet working on therapies for that.

In the meantime, there are 2 or 3 strong therapies being worked on for first order effects.  (nmn or nr, metformin, senescent cells, reprogrammed stem cells to clear proteins... etc)  But lets be clear the SENS stuff is definitely a therapy aimed at a first order symptom, not a cure for aging. (and let me be even more clear, I expect it to be VERY successful, I just want to make sure that everyone knows it's not the final end game.

Here is a link to that previous post of mine:  https://www.reddit.com/r/longevity/comments/9hjevj/the_4_epochs_of_longevity/

And if you read it, you can see EXACTLY where I think money needs to go.",2,1538357797,longevity
70,John_Schlick,"On 1: I left it out because have not heard of the Unity trial (I read as much as I can, and I freely admit there are only so many hours in a day, and I'm not perfect).  Do you have a link to it?  I would love to read it.

2: Double stranded breaks.  What I know is that the proteins (coded for in genes) that are involved in double stranded breaks seem to screw up the epigenome all over the place as part of doing there job.  but only a little bit at a time (as in only a little every time we get a double stranded break, and compounded by when that happens in a stem cell).  Also, there are (this is a number in my head not a well researched number by me) about 200 genes that make proteins that all have a piece of that job.  It's a very complex system.

You may be correct, we may be able to use a gene therapy to edit our dna to perfect those proteins that misbehave.  I would never disount that as an option.  But I personally feel like resetting the epigeniome has tools to do it today, and so it appears to me to be the path of least resistance. and it appears to have a HUGE upside.

3: I do indeed mean ""know something"" not ""know the only thing"".  With every biologic system that I have read papers for, it's a question of assigning percentages of causation.  it's very clear to me that the epigenome gets screwed up and causes cellular disregulation.   but is that the only thing that causes symptoms of aging?   One of the things the SENS people are working on is the removal of extra cellular proteins that build up in the body.    Now, do they build up because we have no genes to get rid of them, or is it because the cells that are supposed to clear them out are not working properly due to being mis-regulated.   I've seen one presentation (and haven't read a peer reviewed paper on it) that macular degeneration (a symptom of aging) is caused due to a build of a specific protein in the eye and there a gene that needs a one base pair change to clear THAT protein.  So, it strikes me that perfectly regulating a gene that can't do the job? Won't solve the problem.

The thing about biological systems is that it's like you as a computer scientist peering into an ai system with 200 variables and none of them are labeled to tell you what they do, and trying to figure out if you can tune the system better than your training data.  They are messy and complicated and have lots nad nlots and lots of unlabeled inputs.

I feel like we are on the cusp of getting to a large number of ways to mitigate aging, but once we do that...  and we wait say another 50 years... what will be the first part of a body to break down after those first treatments - whats the thing that got missed?   When was release 1.0 (or even 4.0) ever perfect?   The answer of course is that it's not.   So, I am positive that even if we can all live longer based on these 4 epochs that it's not the ENTIRITY of the story.",4,1537728136,longevity
71,Slater_John,"That doesnt make economical sense. Any one time cure would be priced higher by the free market, unless the inventor also has **all** the symptom-treating medicine patented too.",9,1523523552,longevity
